{
  "$schema": "https://json-schema.org/draft/2020-12/schema",
  "title": "SJTU hourly UC units, pilot profile 0.1.0",
  "type": "object",
  "additionalProperties": false,
  "required": [
    "n_units",
    "horizon",
    "base_load",
    "pmin",
    "pmax",
    "pstart",
    "pshut",
    "ramp_up",
    "ramp_down",
    "cost_a",
    "cost_b",
    "cost_c",
    "startup_cost",
    "shutdown_cost",
    "min_up",
    "min_down",
    "initial_duration"
  ],
  "properties": {
    "n_units": {
      "type": "integer",
      "minimum": 1
    },
    "horizon": {
      "type": "integer",
      "minimum": 1
    },
    "base_load": {
      "type": "array",
      "minItems": 1,
      "items": {
        "type": "number",
        "minimum": 0
      }
    },
    "pmin": {
      "type": "array",
      "minItems": 1,
      "items": {
        "type": "number",
        "minimum": 0
      }
    },
    "pmax": {
      "type": "array",
      "minItems": 1,
      "items": {
        "type": "number",
        "minimum": 0
      }
    },
    "pstart": {
      "type": "array",
      "minItems": 1,
      "items": {
        "type": "number",
        "minimum": 0
      }
    },
    "pshut": {
      "type": "array",
      "minItems": 1,
      "items": {
        "type": "number",
        "minimum": 0
      }
    },
    "ramp_up": {
      "type": "array",
      "minItems": 1,
      "items": {
        "type": "number",
        "minimum": 0
      }
    },
    "ramp_down": {
      "type": "array",
      "minItems": 1,
      "items": {
        "type": "number",
        "minimum": 0
      }
    },
    "cost_a": {
      "type": "array",
      "minItems": 1,
      "items": {
        "type": "number",
        "minimum": 0
      }
    },
    "cost_b": {
      "type": "array",
      "minItems": 1,
      "items": {
        "type": "number",
        "minimum": 0
      }
    },
    "cost_c": {
      "type": "array",
      "minItems": 1,
      "items": {
        "type": "number",
        "minimum": 0
      }
    },
    "startup_cost": {
      "type": "array",
      "minItems": 1,
      "items": {
        "type": "number",
        "minimum": 0
      }
    },
    "shutdown_cost": {
      "type": "array",
      "minItems": 1,
      "items": {
        "type": "number",
        "minimum": 0
      }
    },
    "initial_output": {
      "type": "array",
      "minItems": 1,
      "items": {
        "type": "number",
        "minimum": 0
      }
    },
    "cold_startup_cost": {
      "type": "array",
      "minItems": 1,
      "items": {
        "type": "number",
        "minimum": 0
      }
    },
    "min_up": {
      "type": "array",
      "minItems": 1,
      "items": {
        "type": "integer",
        "minimum": 1
      }
    },
    "min_down": {
      "type": "array",
      "minItems": 1,
      "items": {
        "type": "integer",
        "minimum": 1
      }
    },
    "initial_duration": {
      "type": "array",
      "minItems": 1,
      "items": {
        "type": "number"
      }
    },
    "cold_start_hours": {
      "type": "array",
      "minItems": 1,
      "items": {
        "type": "integer",
        "minimum": 0
      }
    }
  },
  "dependentRequired": {
    "cold_startup_cost": [
      "cold_start_hours"
    ],
    "cold_start_hours": [
      "cold_startup_cost"
    ]
  }
}
