{
  "n_units": 20,
  "horizon": 24,
  "base_load": [
    1566.440329,
    1482.730211,
    1209.905966,
    1201.181249,
    1222.639336,
    1317.196399,
    1575.165046,
    1922.974692,
    2245.789206,
    2346.241348,
    2358.031506,
    2389.360312,
    2347.656168,
    2159.249449,
    2226.217544,
    2245.081797,
    2235.413868,
    2173.633443,
    2088.272702,
    2116.569079,
    2175.284064,
    2063.513371,
    1876.049865,
    1700.848125
  ],
  "pmin": [
    33.0,
    46.0,
    37.0,
    32.0,
    49.0,
    37.0,
    31.0,
    35.0,
    32.0,
    47.0,
    64.0,
    67.0,
    51.0,
    65.0,
    59.0,
    60.0,
    56.0,
    73.0,
    78.0,
    81.0
  ],
  "pmax": [
    125.0,
    120.0,
    106.0,
    117.0,
    101.0,
    104.0,
    120.0,
    125.0,
    118.0,
    117.0,
    198.0,
    174.0,
    179.0,
    214.0,
    183.0,
    181.0,
    202.0,
    326.0,
    308.0,
    296.0
  ],
  "pstart": [
    125.0,
    120.0,
    106.0,
    117.0,
    101.0,
    104.0,
    120.0,
    125.0,
    118.0,
    117.0,
    198.0,
    174.0,
    179.0,
    214.0,
    183.0,
    181.0,
    202.0,
    326.0,
    308.0,
    296.0
  ],
  "pshut": [
    125.0,
    120.0,
    106.0,
    117.0,
    101.0,
    104.0,
    120.0,
    125.0,
    118.0,
    117.0,
    198.0,
    174.0,
    179.0,
    214.0,
    183.0,
    181.0,
    202.0,
    326.0,
    308.0,
    296.0
  ],
  "ramp_up": [
    39.535111,
    35.702027,
    26.398546,
    40.736241,
    24.56166,
    28.93614,
    43.656099,
    34.103741,
    29.40562,
    34.441011,
    57.808897,
    48.317662,
    49.211146,
    71.187339,
    42.290151,
    40.525455,
    56.411825,
    104.307529,
    84.290102,
    95.480186
  ],
  "ramp_down": [
    42.095759,
    24.855574,
    23.75718,
    29.50909,
    25.995604,
    26.847295,
    37.841862,
    30.926967,
    41.31081,
    27.429171,
    59.228058,
    49.745775,
    53.547133,
    72.607752,
    53.674419,
    60.255896,
    59.221757,
    91.114771,
    95.378983,
    80.378308
  ],
  "min_up": [
    3,
    4,
    4,
    4,
    4,
    4,
    4,
    3,
    3,
    4,
    7,
    8,
    7,
    8,
    7,
    8,
    8,
    13,
    13,
    13
  ],
  "min_down": [
    4,
    4,
    4,
    3,
    3,
    4,
    3,
    4,
    3,
    4,
    8,
    8,
    8,
    8,
    8,
    7,
    8,
    12,
    12,
    13
  ],
  "initial_duration": [
    -4,
    1,
    3,
    -1,
    6,
    4,
    1,
    -5,
    2,
    6,
    6,
    4,
    -7,
    -2,
    3,
    -3,
    -10,
    13,
    -7,
    -11
  ],
  "cost_a": [
    0.020717000000000072,
    0.01354299999999927,
    0.04899300000000013,
    0.07745099999999995,
    0.056215,
    0.022816,
    0.038801,
    0.026371999999999507,
    0.081146,
    0.011065,
    0.008058,
    0.00767,
    0.007771,
    0.007886,
    0.00744999999999961,
    0.008408,
    0.008012999999999671,
    0.005440000000000032,
    0.005851,
    0.002577
  ],
  "cost_b": [
    40.159700999999984,
    47.94064300000012,
    47.50233899999998,
    36.62021100000001,
    44.78441,
    44.540744,
    47.057446,
    43.97272000000008,
    42.671626,
    42.188496,
    58.852874,
    56.557816,
    57.887331,
    60.667137,
    57.308867000000085,
    65.361067,
    64.47636100000008,
    54.777858,
    51.241117,
    52.029814
  ],
  "cost_c": [
    1337.6585960000007,
    1606.413610999996,
    1423.000475000001,
    1238.7513939999994,
    1583.627818,
    1251.224742,
    1478.774181,
    1466.3255399999978,
    1494.90185,
    1647.915526,
    1906.809572,
    2709.771735,
    2294.412616,
    2526.650674,
    2622.5185099999953,
    2907.456123,
    2733.822026999997,
    3844.413939,
    3030.748255,
    3075.343742
  ],
  "startup_cost": [
    174.735349,
    161.167861,
    167.362209,
    166.012685,
    149.811185,
    140.136917,
    160.078127,
    171.471377,
    158.453748,
    169.32738,
    272.405683,
    227.46756,
    275.809972,
    304.209075,
    287.024247,
    244.08442,
    265.229245,
    451.079504,
    472.88152,
    452.080646
  ],
  "shutdown_cost": [
    0.0,
    0.0,
    0.0,
    0.0,
    0.0,
    0.0,
    0.0,
    0.0,
    0.0,
    0.0,
    0.0,
    0.0,
    0.0,
    0.0,
    0.0,
    0.0,
    0.0,
    0.0,
    0.0,
    0.0
  ],
  "initial_output": [
    0.0,
    104.664717,
    48.800241,
    0.0,
    64.702219,
    66.927883,
    66.568123,
    0.0,
    104.712125,
    67.639693,
    80.293299,
    133.790927,
    0.0,
    0.0,
    91.581503,
    0.0,
    0.0,
    264.269012,
    0.0,
    0.0
  ]
}
